{
  "$schema": "http://json-schema.org/draft-07/schema#",
  "$id": "toll-the-game/scripts/lora/characters/profile.schema.json",
  "title": "Character art profile",
  "description": "One file per playable character, scripts/lora/characters/<id>.json: the state of that character's art, from the design lock to the installed tile. Scripts read the keys marked 'read by'; everything else is the record a later session needs. A new profile comes from `python scripts/lora/new_profile.py <id> --trigger <word>`, never from copying another character's file (his rule, 2026-10-13). Checked by `python scripts/lora/check_profile.py <id>`. The method is docs/CHARACTER_ART.md; the step skills are charlora, kitart and artinstall.",
  "type": "object",
  "required": ["id", "trigger", "face_ref", "identity", "identity_upper", "negative_extra"],
  "properties": {
    "id": {
      "type": "string",
      "pattern": "^[a-z][a-z0-9_]*$",
      "description": "The character id, the same as data/characters/<id>.json. Read by every script."
    },
    "trigger": {
      "type": "string",
      "pattern": "^[a-z]+toll$",
      "description": "The LoRA trigger word, <id>toll by convention (duketoll, lyratoll). Read by stage_dataset.py (captions) and test_checkpoints.py."
    },
    "face_ref": {
      "type": "string",
      "description": "File name in ComfyUI input/ of the face-only crop of the locked design, used at IP-Adapter PLUS FACE 0.6 (step 1). A full image bleeds costume and background in. Read by gen_candidates.py and test_checkpoints.py."
    },
    "identity": {
      "type": "string",
      "description": "The full-body identity prompt: quality tags, 1girl|1boy, solo, age, build, hair, eyes, every garment and its colour, weighted on the defining words. No expression (that lives in the shot). stage_dataset.py reads '1boy' from it to pick the caption subject. Read by gen_candidates.py."
    },
    "identity_upper": {
      "type": "string",
      "description": "The identity prompt with the lower-body garments removed, for 1024x1024 close-ups; naming trousers in a head shot makes the model cram in a whole body, often two. Read by gen_candidates.py."
    },
    "negative_extra": {
      "type": "string",
      "description": "Appended to common.NEG_BASE for this character: the looks it must not drift to (child, teenager, the wrong garment colours, thighhighs). Read by gen_candidates.py."
    },
    "body_shots": {
      "type": "array",
      "minItems": 1,
      "description": "The full-body dataset slots as [slug, clause] or [slug, clause, flag] rows; flag is 'noref' (no face reference), 'back' (no face reference, the drawn back skeleton) or 'pose:<name>' (the Blender mannequin holds an action shot; gen_candidates.py). Ruling #186: about a third of these are action shots (a lunge, a sprint, a strike, a turn, a crouch), each different, and the calm front-facing standing figure is a few slots, never the set. Read by gen_candidates.py.",
      "items": {
        "type": "array",
        "minItems": 2,
        "maxItems": 3,
        "items": [
          { "type": "string", "pattern": "^[a-z0-9_]+$", "description": "slug: the file name stem" },
          { "type": "string", "description": "clause: framing, pose, expression, hood state; written from what the image should show" },
          { "type": "string", "pattern": "^(noref|back|pose:[a-z0-9_]+)$", "description": "noref, back, or pose:<name> (a mannequin pose in scripts/pose/poses/)" }
        ]
      }
    },
    "face_shots": {
      "type": "array",
      "minItems": 0,
      "description": "The close-up slots as [slug, clause] rows: facing, head turn, expression. Read by gen_candidates.py.",
      "items": {
        "type": "array",
        "minItems": 2,
        "maxItems": 3,
        "items": [
          { "type": "string", "pattern": "^[a-z0-9_]+$" },
          { "type": "string" },
          { "type": "string", "enum": ["noref", "back"] }
        ]
      }
    },
    "style": {
      "type": "string",
      "description": "Overrides the style tail of the dataset prompt (default in gen_candidates.py). Read by gen_candidates.py."
    },
    "out_dir": {
      "type": "string",
      "description": "ComfyUI output folder for candidates (default lora_<id>). Read by gen_candidates.py."
    },
    "dataset_name": {
      "type": "string",
      "description": "The staging folder name for this dataset version (default <id>_v1). A new version gets a new name so earlier sets are never overwritten. Read by stage_dataset.py."
    },
    "batch": {
      "type": "integer",
      "minimum": 1,
      "maximum": 8,
      "description": "Images per slot (default 4). Read by gen_candidates.py."
    },
    "seed_offset": {
      "type": "integer",
      "minimum": 0,
      "description": "Bump to re-roll a slot with fresh seeds (default 0). Read by gen_candidates.py."
    },
    "hand_fix": {
      "type": "boolean",
      "description": "The 512px hand pass on body shots (default false). One job per image. OFF for brown skin: it painted pale glowing hands on Duke. Read by gen_candidates.py."
    },
    "face_hand_fix": {
      "type": "boolean",
      "description": "The hand pass on close-ups too (default false; Duke's head shots came back with burnt neon skin with it on). Read by gen_candidates.py."
    },
    "hand_extra": {
      "type": "string",
      "description": "Extra prompt for the hand pass. Read by gen_candidates.py."
    },
    "hood_down_negative": {
      "type": "string",
      "description": "Negative added only to shots whose clause says 'hood down' (Sara). Read by gen_candidates.py."
    },
    "hood_default": {
      "type": "string",
      "enum": ["up", "down", "none"],
      "description": "The hood state the LoRA should assume when a prompt does not name one; every shot still names it (CHARACTER_ART.md step 1)."
    },
    "design_note": {
      "type": "string",
      "description": "The locked look in prose: every garment and colour, hood state, age, build, what is banned. Written at the design lock (step 0)."
    },
    "approved_refs": {
      "type": "array",
      "items": { "type": "string" },
      "description": "Older profiles (Lyra, Sara v1): the approved reference images by path, before `approved` carried captions."
    },
    "lock": {
      "type": ["object", "null"],
      "description": "The design lock record: when, how he chose (option labels are Claude's wording, his selections), the face source file, what was fixed in code. Null until he locks.",
      "properties": {
        "date": { "type": "string", "pattern": "^\\d{4}-\\d{2}-\\d{2}$" },
        "how": { "type": "string" },
        "face_source": { "type": "string" }
      },
      "required": ["date", "how"]
    },
    "approved": {
      "type": "object",
      "description": "The approved dataset images by his number: { \"E3\": { \"file\": \"<output path>\", \"caption\": \"<caption as corrected by him>\" } }. Written after the caption gate (step 1). Older profiles hold a plain string or a file-only object per number.",
      "additionalProperties": {
        "type": ["object", "string"],
        "properties": {
          "file": { "type": "string" },
          "caption": { "type": "string" }
        }
      }
    },
    "dataset": {
      "type": "string",
      "description": "Where the staged dataset lives and what is in it (count, versions, backups)."
    },
    "training": {
      "type": "object",
      "description": "The training run record: the run name, images, recipe (always the frozen one), start and finish, where the checkpoints and test sheets are.",
      "properties": {
        "run": { "type": "string" },
        "checkpoints": { "type": "string" },
        "test_sheet": { "type": "string" }
      }
    },
    "lora": {
      "type": "string",
      "description": "The installed LoRA file name in ComfyUI models/loras (<id>_toll.safetensors), with a note when a version was superseded. Written when he picks the step (step 2)."
    },
    "lora_checkpoint": {
      "type": "integer",
      "description": "The step he picked. 2000 for the final save, which has no step number in its file name."
    },
    "lora_pick": {
      "type": "string",
      "description": "His pick in his words, and what Claude recommended, so the next session knows they differed if they did."
    },
    "lora_use": {
      "type": ["object", "string", "null"],
      "description": "How to prompt this LoRA, learned from the checkpoint tests: the prompt shape that works (short plain, or the weighted identity), what to always state, what to add to the negative, what to watch for. Read by a session before any kit art. Null until the LoRA exists.",
      "properties": {
        "note": { "type": "string" },
        "prompt": { "type": "string" },
        "why": { "type": "string" },
        "always_state": { "type": "string" },
        "negative": { "type": "string" },
        "watch": { "type": "string" }
      }
    },
    "art_direction": {
      "type": ["object", "null"],
      "description": "His direction for the kit art: the aura colour in his words, his pose ideas per slot, his picks per round. Null until he has given any.",
      "properties": {
        "aura": { "type": "string" },
        "skills": { "type": "string" }
      }
    },
    "qc_tags": {
      "type": ["object", "null"],
      "description": "Danbooru tags for scripts/lora/tag_candidates.py (the WD14 QC pass): `ban` flags an image that carries one (this character's drift), `expect` flags one that lacks it. A filter for Claude before a sheet, never a verdict.",
      "properties": {
        "ban": { "type": "array", "items": { "type": "string", "pattern": "^[a-z0-9_()'-]+$" } },
        "expect": { "type": "array", "items": { "type": "string", "pattern": "^[a-z0-9_()'-]+$" } }
      }
    },
    "kit_prompt": {
      "type": ["object", "null"],
      "description": "Machine-readable prompts for scripts/skill_art/kit_drafts.py and official_render.py. The recipe (action wording, style, ControlNet strengths, the generic negatives) lives in the scripts; this block holds only what is this character's. Null until the LoRA is installed and the slot plan is approved.",
      "required": ["lora", "draft", "official", "slots"],
      "properties": {
        "lora": { "type": "string", "description": "The installed LoRA file in models/loras." },
        "draft_lora_strength": { "type": "number", "description": "0.65 for a LoRA trained on a calm set; 0.9 once the set carries action shots (ruling #186). Default 0.65." },
        "draft": {
          "type": "object",
          "required": ["body", "negative"],
          "properties": {
            "body": { "type": "string", "description": "Trigger plus the short plain identity the LoRA wants (see lora_use)." },
            "negative": { "type": "string", "description": "This character's drift words only; NEG_BASE and the recipe negative are added by the script." }
          }
        },
        "official": {
          "type": "object",
          "required": ["body", "negative"],
          "properties": {
            "body": { "type": "string", "description": "The identity with hair and every garment stated (step 4)." },
            "negative": { "type": "string", "description": "This character's drift words for the official render, hair drift included." }
          }
        },
        "slots": {
          "type": "object",
          "description": "Slot name to its pose variants, from the slot plan he approved (kitart step 3a).",
          "additionalProperties": {
            "type": "array",
            "minItems": 1,
            "items": {
              "type": "object",
              "required": ["clause"],
              "properties": {
                "pose": { "type": "string", "description": "A mannequin pose in scripts/pose/poses/ (rendered to ComfyUI input/)." },
                "skeleton": { "type": "string", "description": "A DWPose reference skeleton file in ComfyUI input/." },
                "name": { "type": "string", "description": "A label for a prompt-only variant." },
                "clause": { "type": "string", "description": "The draft's action clause: the moment, as a verb." },
                "official_clause": { "type": "string", "description": "The official render's clause, if it differs." }
              }
            }
          }
        }
      }
    },
    "kit_art": {
      "type": ["object", "string", "null"],
      "description": "The kit-art record: the slot plan he approved, his draft picks per slot, the official render method and the chosen renders, what is locked, what is installed.",
      "properties": {
        "date": { "type": "string" },
        "note": { "type": "string" },
        "slot_plan": { "type": "string" },
        "picks": { "type": "object" },
        "official_method": { "type": "string" },
        "chosen_renders": { "type": "object" },
        "locked": { "type": "string" },
        "installed": { "type": "string" }
      }
    },
    "portrait": {
      "type": "string",
      "description": "The portrait crop record: the source cut-out and the make_portrait_crop.py numbers, so a sharper source reuses the framing (step 6)."
    },
    "tile": {
      "type": "string",
      "description": "The tile crop record: the source cut-out, where the headroom stops and why, the TILE_ART ratio, the ART_VERSION bump (step 6)."
    },
    "status": {
      "type": "string",
      "description": "Free text for a character that is held or mid-step: what was rendered, what is not reviewed, what needs options before the next batch."
    }
  },
  "additionalProperties": true
}
